{
  "schema_version": 1,
  "id": "erg",
  "name": "Ergo",
  "trusted": true,
  "symbol": "ERG",
  "algorithm": "autolykos2",
  "recommended_miner": "external-gpu",
  "cpu_mineable": false,
  "default_pools": [
    {
      "name": "Flypool",
      "stratum_url": "stratum+ssl://ergo.flypool.org:3443",
      "tls": true,
      "region": "global"
    },
    {
      "name": "2Miners",
      "stratum_url": "stratum+ssl://erg.2miners.com:18888",
      "tls": true,
      "region": "global"
    },
    {
      "name": "HeroMiners",
      "stratum_url": "stratum+ssl://ergo.herominers.com:1180",
      "tls": true,
      "region": "global"
    }
  ],
  "notes": "Ergo uses Autolykos2 algorithm. GPU mining recommended."
}
