{
  "schema_version": 1,
  "id": "xmr",
  "name": "Monero",
  "symbol": "XMR",
  "algorithm": "randomx",
  "recommended_miner": "xmrig",
  "cpu_mineable": true,
  "default_pools": [
    {
      "name": "MoneroOcean",
      "stratum_url": "stratum+ssl://gulf.moneroocean.stream:20128",
      "tls": true,
      "region": "global"
    },
    {
      "name": "2Miners",
      "stratum_url": "stratum+ssl://xmr.2miners.com:12222",
      "tls": true,
      "region": "global"
    },
    {
      "name": "Nanopool",
      "stratum_url": "stratum+ssl://xmr-eu1.nanopool.org:14433",
      "tls": true,
      "region": "eu"
    },
    {
      "name": "SupportXMR",
      "stratum_url": "stratum+tcp://pool.supportxmr.com:3333",
      "tls": false,
      "region": "global"
    }
  ],
  "notes": null,
  "trusted": true
}